{
  "formatVersion": 1,
  "tool": {"name":"whydiff","version":"0.0.1","source":"cdp","browser":"chromium 147.0.0"},
  "page": {"url":"http://app.test/","title":"Fixture"},
  "image": {"width":1000,"height":800,"k":1,"layoutFactor":1,"origin":[0,0],"fullPage":false},
  "viewport": {"width":1000,"height":800,"scrollX":0,"scrollY":0},
  "content": {"width":1000,"height":800},
  "compare": {"threshold":0.2,"animations":"disabled","caret":"hide","scale":"css"},
  "frames": [{"url":"http://app.test/","owner":null,"offset":[0,0],"scroll":[0,0],"status":"captured"}],
  "masks": [],
  "sheets": [],
  "props": ["display","flex-direction","color","font-size","font-weight","line-height","letter-spacing","opacity","border-top-style","border-top-color"],
  "styles": [
    ["block","row","rgb(0, 0, 0)","16px","400","normal","normal","1","none","rgb(0, 0, 0)"]
  ],
  "nodes": [
    {"i":0,"p":-1,"tag":"html","box":[0,0,1000,800],"s":0},
    {"i":1,"p":0,"tag":"body","box":[0,0,1000,800],"s":0},
    {"i":2,"p":1,"tag":"ul","box":[0,0,200,100],"scroll":[0,25,200,300],"s":0},
    {"i":3,"p":2,"tag":"li","text":"One","box":[0,-25,200,50],"s":0},
    {"i":4,"p":2,"tag":"li","text":"Two","box":[0,25,200,50],"s":0}
  ]
}
