{
  "formatVersion": 1,
  "tool": {"name":"whydiff","version":"0.0.1","source":"cdp","browser":"chromium 147.0.0"},
  "page": {"url":"http://app.test/","title":"Fixture"},
  "image": {"width":1000,"height":800,"k":1,"layoutFactor":1,"origin":[0,0],"fullPage":false},
  "viewport": {"width":1000,"height":800,"scrollX":0,"scrollY":0},
  "content": {"width":1000,"height":800},
  "compare": {"threshold":0.2,"animations":"disabled","caret":"hide","scale":"css"},
  "frames": [{"url":"http://app.test/","owner":null,"offset":[0,0],"scroll":[0,0],"status":"captured"}],
  "masks": [],
  "sheets": [],
  "props": ["display"],
  "styles": [
    ["block"]
  ],
  "nodes": [
    {"i":0,"p":-1,"tag":"html","box":[0,0,1000,800],"s":0},
    {"i":1,"p":0,"tag":"body","box":[0,0,1000,800],"s":0},
    {"i":2,"p":1,"tag":"main","box":[0,0,1000,300],"s":0},
    {"i":3,"p":2,"tag":"section","cls":["faq"],"box":[0,0,1000,100],"s":0},
    {"i":4,"p":3,"tag":"h2","text":"Support","box":[0,0,1000,40],"s":0},
    {"i":5,"p":3,"tag":"p","text":"Chat with us at any time.","box":[0,40,1000,60],"s":0},
    {"i":6,"p":2,"tag":"section","cls":["faq"],"box":[0,100,1000,100],"s":0},
    {"i":7,"p":6,"tag":"h2","text":"Returns","box":[0,100,1000,40],"s":0},
    {"i":8,"p":6,"tag":"p","text":"Thirty days, no questions asked.","box":[0,140,1000,60],"s":0},
    {"i":9,"p":2,"tag":"section","cls":["faq"],"box":[0,200,1000,100],"s":0},
    {"i":10,"p":9,"tag":"h2","text":"Shipping","box":[0,200,1000,40],"s":0},
    {"i":11,"p":9,"tag":"p","text":"Orders ship within two days.","box":[0,240,1000,60],"s":0}
  ]
}
