{
  "formatVersion": 1,
  "tool": {"name":"whydiff","version":"0.0.1","source":"cdp","browser":"chromium 147.0.0"},
  "page": {"url":"http://app.test/","title":"Fixture"},
  "image": {"width":1000,"height":800,"k":1,"layoutFactor":1,"origin":[0,0],"fullPage":false},
  "viewport": {"width":1000,"height":800,"scrollX":0,"scrollY":0},
  "content": {"width":1000,"height":800},
  "compare": {"threshold":0.2,"animations":"disabled","caret":"hide","scale":"css"},
  "frames": [{"url":"http://app.test/","owner":null,"offset":[0,0],"scroll":[0,0],"status":"captured"}],
  "masks": [],
  "sheets": [],
  "props": ["display"],
  "styles": [
    ["block"]
  ],
  "nodes": [
    {"i":0,"p":-1,"tag":"html","box":[0,0,1000,800],"s":0},
    {"i":1,"p":0,"tag":"body","box":[0,0,1000,800],"s":0},
    {"i":2,"p":1,"tag":"ul","cls":["changelog"],"box":[0,0,600,120],"s":0},
    {"i":3,"p":2,"tag":"li","cls":["entry"],"box":[0,0,600,60],"s":0},
    {"i":4,"p":3,"tag":"h3","text":"Release","box":[0,0,600,30],"s":0},
    {"i":5,"p":3,"tag":"span","text":"v2","box":[0,30,100,30],"s":0},
    {"i":6,"p":2,"tag":"li","cls":["entry"],"box":[0,60,600,60],"s":0},
    {"i":7,"p":6,"tag":"h3","text":"Hotfix","box":[0,60,600,30],"s":0},
    {"i":8,"p":6,"tag":"span","text":"v1","box":[0,90,100,30],"s":0}
  ]
}
