{
  "formatVersion": 1,
  "tool": {"name":"whydiff","version":"0.0.1","source":"cdp","browser":"chromium 147.0.7"},
  "page": {"url":"http://localhost:5173/","title":"Minimal"},
  "image": {"width":200,"height":100,"k":1,"layoutFactor":1,"origin":[0,0],"fullPage":false},
  "viewport": {"width":200,"height":100,"scrollX":0,"scrollY":0},
  "content": {"width":200,"height":100},
  "compare": {"threshold":0.2,"animations":"disabled","caret":"hide","scale":"css"},
  "frames": [{"url":"http://localhost:5173/","owner":null,"offset":[0,0],"scroll":[0,0],"status":"captured"}],
  "masks": [],
  "sheets": [],
  "props": ["display","color"],
  "styles": [
    ["block","rgb(0, 0, 0)"]
  ],
  "nodes": [
    {"i":0,"p":-1,"tag":"html","box":[0,0,200,100],"s":0}
  ]
}
